,UserId,Skills,UsersPosition,YearsOfExperience,EnglishLevel
8485,676774,"web services, test planning and test script, shell script, selenium, microsoft team foundation server, telecommunication, test management, test automation, sql query, rational quality manager, java, soapui",Test Automation Engineering Specialist,11,0
8616,677210,"javascript, node.js, xml, itil, junit, docker, jira, jenkins, devops, jmeter, ccnp, selenium, bugzilla, continuos deployment, test management, mochajs, msbuild, c#, agile and kanban process, xunit, nunit, php, java, jquery, git",Software QA & Test Automation Engineer,12,3
8627,677240,"test planning and test script, jmeter, selenium, test management, test automation, test case, test design, functional testing",ISTQB Certified Software Test Engineer,2,0
8670,677423,"sql, sql server, scrum, uml, c, testing, soap, xml, visual studio, microsoft visual studio, oracle db, tfs, testlink, quality center, test management, hp quality center, mantis, java","Test Leader, Quality's Analyst and System's Analys",14,0
8828,678015,"javascript, python, testing, html5, css3, node.js, selenium, test automation, appium, webdriver, java",Software Development Engineer in Test,9,4
8855,678077,"javascript, python, html5, node.js, open source, express.js, full stack, linux, backend development",Express/NodeJS backend developer,6,3
8858,678092,"sql server, 3d studio max html5, peoplesoft, e-commerce, microsoft sharepoint, selenium, etl, estimation, corporate finance, it operations, ibm rational clear case, application lifecycle management, ado.net, healthcare, claims, asp.net ajax control toolkit, oracle retail, database acces, jquery, .net",Test Analyst,6,3
8936,678309,"sql, javascript, python, laravel, mvc, html, postgresql, css, node.js, yii, github, rest api, go lang, selenium, data mining, api, machine learning, digital ocean, es6, amazon ec2, php, jquery, git, aws","FullStack Web Developer - PHP, Python, NodeJS",9,3
8959,678402,"automation, selenium, hp quality center, manual testing, functional testing, tosca test suite, automation testing",Automation Test Engineer with 4+years of Experienc,4,3
9043,678762,"quality assurance, support analyst",QA Software Tester with Internacional Experience,4,0
9074,678877,"ruby on rails, microsoft office, hardware, lean manufacturing, six sigma, testing, windows, visual studio, github, software development, jira, jenkins, batch script, problem solving, leadership, rabbit mq, cucumber, process improvement, test automation, test case, performance test planning, c#, visual studio code, intellij, manual testing, swagger, functional testing, kubernetes, manufacturing knowledge, linux, java, git, aws",Software Test Engineer,14,3
9089,678943,"scrum, agile, jira, rest api, quality assurance, software developer, selenium, leadership, startups, documentation, cucumber, java, ui path","Software Test Engineer,  looking for overseas oppo",3,3
9218,679394,"sql, scrum, unix, jmeter, quality assurance, microsoft word, selenium, quality center, uft, test automation, test case, microsoft excel, appium, manual testing, test design, functional testing, agile & waterfall methodologies, java",Software Tester/QA Engineer/Mentor/Leader,5,3
9298,679621,"javascript, python, laravel, html5, css3, node.js, django, php","PHP/Laravel,Python/Django,JavaScript/NodeJS /React",5,0
9383,679896,"javascript, python, english, html, css, mongodb, github, bitbucket, django, front end, meteor, api, django rest, data structures, backend development, jquery, git",Fullstack Developer (React + Python or NodeJS),5,3
9608,680616,"iptables firewall, linux sysadmin, portuguese, security assessment and testing, information security, owasp, nessus, nmap, burp suite, pentest, cyber security, burp, ness, appscan",Information Security Analyst - Penetration Tester,8,3
9682,680835,"scrum, javascript, swift, soap, jira, tfs, selenium, express.js, cucumber, test automation, kotlin, c#, xctest, java","QA Engineer, Test Automation",2,0
9734,681008,"selenium, uft, manual testing",Test Automation Engineer,4,3
9857,681500,"android, sql, python, testing, ios, jenkins, devops, a/b tests, quality assurance, alm, selenium, rtc, api, cucumber, hp quality center, webdriver, android studio, java, selenium webdriver, jagacy",Test engineer,5,3
9939,681818,automated testing,Test Automation Engineering Analyst-IT ,8,0
9998,682038,"testing, test planning and test script, jira, unix, alm, qa director certified, visio, office 365, perl, estimation, qa, rfp, continuos deployment, offshore, sdlc audit, cisco certified networking associate, uft, test management, corporate finance, hp quality center, finance, it operations, test case, application lifecycle management, test-driven development (tdd), test design, ability to meet deadlines., credit recovery, trainer, project coordination, budgeting, forecasting, database acces, training & mentoring, leading skills, automated testing, git",Senior Test Manager,17,3
